{
  "schema": "gary.project-state.v2",
  "project_id": "telltail-v03-fresh-r2",
  "state": "ACTIVE",
  "generation": 1,
  "activities": [
    "PLANNING"
  ],
  "yardmaster_state": "RUNNING",
  "completion": "ACTIVE",
  "current_phase": "planning",
  "current_strategy": "Establish project manual, construct Go domain model and SHA-256 hash-chained JSONL trajectory engine, implement deterministic detectors and profiler, implement local runner, GCP Batch client/lifecycle harness, Mirror Shift challenge evaluator, write comprehensive tests with fault injection, execute local and cloud canaries, and emit GARY shift report.",
  "watchdog": {},
  "last_event": "planning wave 1",
  "reason": "planning wave 1",
  "updated_by": "Yardmaster",
  "updated_at": "2026-09-03T09:31:01.515922629Z"
}
